{
  "$schema": "https://json-schema.org/draft/2020-12/schema",
  "title": "profile_settings_sync fixture",
  "type": "object",
  "required": [
    "contract_version",
    "suite",
    "case_id",
    "input",
    "expected"
  ],
  "properties": {
    "contract_version": {
      "type": "integer",
      "minimum": 1
    },
    "suite": {
      "const": "profile_settings_sync"
    },
    "case_id": {
      "type": "string",
      "minLength": 1
    },
    "input": {
      "type": "object",
      "required": [
        "local",
        "server"
      ],
      "properties": {
        "local": {
          "type": "object",
          "properties": {
            "display_name": {
              "type": [
                "string",
                "null"
              ]
            },
            "avatar_url": {
              "type": [
                "string",
                "null"
              ]
            },
            "sync_provider": {
              "type": [
                "string",
                "null"
              ]
            },
            "onboarding_step": {
              "type": [
                "string",
                "null"
              ]
            },
            "onboarding_completed_at_ms": {
              "type": [
                "integer",
                "null"
              ]
            }
          },
          "additionalProperties": false
        },
        "server": {
          "type": "object",
          "properties": {
            "display_name": {
              "type": [
                "string",
                "null"
              ]
            },
            "avatar_url": {
              "type": [
                "string",
                "null"
              ]
            },
            "sync_provider": {
              "type": [
                "string",
                "null"
              ]
            },
            "onboarding_step": {
              "type": [
                "string",
                "null"
              ]
            },
            "onboarding_completed_at_ms": {
              "type": [
                "integer",
                "null"
              ]
            }
          },
          "additionalProperties": false
        }
      },
      "additionalProperties": false
    },
    "expected": {
      "type": "object",
      "required": [
        "merged"
      ],
      "properties": {
        "merged": {
          "type": "object",
          "properties": {
            "display_name": {
              "type": [
                "string",
                "null"
              ]
            },
            "avatar_url": {
              "type": [
                "string",
                "null"
              ]
            },
            "sync_provider": {
              "type": [
                "string",
                "null"
              ]
            },
            "onboarding_step": {
              "type": [
                "string",
                "null"
              ]
            },
            "onboarding_completed_at_ms": {
              "type": [
                "integer",
                "null"
              ]
            }
          },
          "additionalProperties": false
        }
      },
      "additionalProperties": false
    }
  },
  "additionalProperties": false
}
